{
  "meta": { "title": "Privacy Policy | SaraZ", "description": "How we handle your data" },
  "state": {},
  "layout": "store",
  "content": {
    "type": "Box",
    "props": { "className": "mx-auto max-w-3xl px-4 sm:px-6 py-12 md:py-16" },
    "children": [
      { "type": "Heading", "props": { "size": "2xl", "className": "mb-8 font-light" }, "text": "Privacy Policy" },
      { "type": "Text", "props": { "className": "text-[var(--theme-shop-text)] leading-relaxed mb-6" }, "text": "We collect information you provide when placing orders, creating an account, or contacting us. This includes name, email, address, and payment details." },
      { "type": "Text", "props": { "className": "text-[var(--theme-shop-text)] leading-relaxed mb-6" }, "text": "We use this information to process orders, improve our services, and communicate with you. We do not sell your personal data to third parties." },
      { "type": "Text", "props": { "className": "text-[var(--theme-shop-text)] leading-relaxed" }, "text": "You may request access to or deletion of your data at any time by contacting us." }
    ]
  }
}
