{
  "meta": { "title": "Shipping Policy | SaraZ", "description": "Our shipping information" },
  "state": {},
  "layout": "store",
  "content": {
    "type": "Box",
    "props": { "className": "mx-auto max-w-3xl px-4 sm:px-6 py-12 md:py-16" },
    "children": [
      { "type": "Heading", "props": { "size": "2xl", "className": "mb-8 font-light" }, "text": "Shipping Policy" },
      { "type": "Text", "props": { "className": "text-[var(--theme-shop-text)] leading-relaxed mb-6" }, "text": "We offer standard (5-7 business days) and express (2-3 business days) shipping within the UAE. Free shipping on orders over AED 200." },
      { "type": "Text", "props": { "className": "text-[var(--theme-shop-text)] leading-relaxed mb-6" }, "text": "International shipping is available to select countries. Delivery times vary by destination." },
      { "type": "Text", "props": { "className": "text-[var(--theme-shop-text)] leading-relaxed" }, "text": "Orders are processed within 1-2 business days. You will receive a tracking number once your order ships." }
    ]
  }
}
